prd_cd,MES_ITEM_CD,prd_nm,prd_typ_cd,semi_role_cd,nonspec_yn,file_upload_yn,editor_yn,min_qty,max_qty,qty_incr,dflt_qty,constraint_json,use_yn,reg_dt,upd_dt,qty_unit_typ_cd,_src_prd_nm,_provenance
PRD_NEW_DCAL_1,,디자인탁상형캘린더,PRD_TYPE.04,,N,N,Y,1,10000,1,,,Y,2026-06-05 00:00:00,,QTY_UNIT.01,탁상형캘린더,"design-calendar L1 row3 탁상형캘린더 디자인보유●·가격10400·30P·몽블랑190g. file_upload_yn=N/editor_yn=Y(라이브 (N,Y) 선례=포토북[디자인명]). prd_cd=placeholder(실번호 후니 부여, 라이브 max PRD_000280 이후). 명명=포토북[디자인명] 방식 참조"
PRD_NEW_DCAL_2,,디자인미니탁상형캘린더,PRD_TYPE.04,,N,N,Y,1,10000,1,,,Y,2026-06-05 00:00:00,,QTY_UNIT.01,미니탁상형캘린더,"design-calendar L1 row8 미니탁상형캘린더 디자인보유●·가격6500·26P·몽블랑190g. (N,Y) 신규. placeholder"
PRD_NEW_DCAL_3,,디자인엽서캘린더,PRD_TYPE.04,,N,N,Y,1,10000,1,,,Y,2026-06-05 00:00:00,,QTY_UNIT.01,엽서캘린더,"design-calendar L1 row11 엽서캘린더 가격4000·12P·몽블랑190g·우드거치대. 단 L1 디자인보유● 셀 비표시(컨펌Q-DC-1: 디자인엽서를 디자인캘린더 멤버로 등록할지 확정). (N,Y) 신규. placeholder"
PRD_NEW_DCAL_4,,디자인벽걸이캘린더,PRD_TYPE.04,,N,N,Y,1,10000,1,,,Y,2026-06-05 00:00:00,,QTY_UNIT.01,벽걸이캘린더,"design-calendar L1 row14 벽걸이캘린더 디자인보유●·가격9900·13P·몽블랑190g·고리형트윈링. (N,Y) 신규. placeholder"
PRD_NEW_DCAL_5,,디자인와이드벽걸이캘린더,PRD_TYPE.04,,N,N,Y,1,10000,1,,,Y,2026-06-05 00:00:00,,QTY_UNIT.01,와이드벽걸이캘린더,"design-calendar L1 row16 와이드벽걸이캘린더 디자인보유●·가격24000·13P·몽블랑190g(3절)·고리형트윈링. (N,Y) 신규. placeholder"
